<?xml version="1.0" encoding="UTF-8" ?>
<!DOCTYPE levels SYSTEM "scenario.dtd">
<levels>
    <level world="world1multiplayer.xml">
        <player id="A" entrance="left" />
        <player id="B" entrance="center" />
        <player id="C" entrance="right" />
    </level>
    <level world="world2.xml">
        <player id="A" entrance="left" />
        <updater id="Walls" />
    </level>
    <level world="world3multiplayer.xml">
        <player id="A" entrance="center" />
        <player id="A" entrance="left" />
        <updater id="Enemies" />
    </level>
    <level world="world1.xml">
        <player id="A" entrance="center" />
        <updater id="Enemies" />
    </level>
    <level world="world2multiplayer.xml">
        <player id="A" entrance="left" />
        <player id="B" entrance="right" />
        <updater id="Enemies" />
        <updater id="Walls" />
    </level>
    <level world="world3.xml">
        <player id="A" entrance="center" />
        <updater id="Enemies" />
        <updater id="Walls" />
    </level>
</levels>